{
  "$schema": "https://json-schema.org/draft/2020-12/schema",
  "$id": "https://github.com/smyrdev/samy-workout-skills/skills/onboarding/assets/schema/profile.schema.json",
  "title": "Training profile",
  "description": "profile/profile.json — written once by the onboarding skill. One profile per repository.",
  "type": "object",
  "required": [
    "$schema_version",
    "created_at",
    "updated_at",
    "user",
    "units",
    "basics",
    "experience",
    "gym",
    "strength_benchmarks"
  ],
  "additionalProperties": false,
  "properties": {
    "$schema_version": { "const": "1.0" },
    "created_at": {
      "type": "string",
      "pattern": "^\\d{4}-\\d{2}-\\d{2}T\\d{2}:\\d{2}:\\d{2}Z$"
    },
    "updated_at": {
      "type": "string",
      "pattern": "^\\d{4}-\\d{2}-\\d{2}T\\d{2}:\\d{2}:\\d{2}Z$"
    },
    "user": {
      "type": "object",
      "required": ["name"],
      "additionalProperties": false,
      "properties": {
        "name": { "type": "string", "minLength": 1 }
      }
    },
    "units": { "enum": ["metric", "imperial"] },
    "basics": {
      "type": "object",
      "required": ["sex", "date_of_birth", "height", "weight", "bodyfat_bracket"],
      "additionalProperties": false,
      "properties": {
        "sex": { "enum": ["male", "female"] },
        "date_of_birth": {
          "type": "string",
          "pattern": "^\\d{4}(-\\d{2}-\\d{2})?$",
          "description": "\"YYYY-MM-DD\", or bare \"YYYY\" if only a year was given. Never a decade, never padded to Jan 1."
        },
        "height": {
          "type": "object",
          "required": ["value", "unit"],
          "additionalProperties": false,
          "properties": {
            "value": { "type": "number", "exclusiveMinimum": 0 },
            "unit": { "enum": ["cm", "in"] }
          }
        },
        "weight": {
          "type": "object",
          "required": ["value", "unit"],
          "additionalProperties": false,
          "properties": {
            "value": { "type": "number", "exclusiveMinimum": 0 },
            "unit": { "enum": ["kg", "lb"] }
          }
        },
        "bodyfat_bracket": {
          "enum": ["3-4", "5-7", "8-12", "13-17", "18-23", "24-29", "30-34", "35-39", "40+"]
        }
      }
    },
    "experience": {
      "type": "object",
      "required": ["lifting", "cardio"],
      "additionalProperties": false,
      "properties": {
        "lifting": { "enum": ["none", "beginner", "intermediate", "advanced"] },
        "cardio": { "enum": ["none", "beginner", "intermediate", "advanced"] }
      }
    },
    "gym": {
      "type": "object",
      "required": ["type", "notes"],
      "additionalProperties": false,
      "properties": {
        "type": {
          "enum": ["everything_gym", "commercial_gym", "warehouse_gym", "local_gym", "garage_gym"]
        },
        "notes": { "type": ["string", "null"] }
      }
    },
    "strength_benchmarks": {
      "type": "object",
      "required": [
        "pullups_5",
        "pullups_10",
        "dips_10",
        "pushups_15",
        "bench_press_10",
        "incline_press_10",
        "overhead_press_10"
      ],
      "additionalProperties": false,
      "properties": {
        "pullups_5": { "type": "boolean" },
        "pullups_10": { "type": "boolean" },
        "dips_10": { "type": "boolean" },
        "pushups_15": { "type": "boolean" },
        "bench_press_10": { "type": "boolean" },
        "incline_press_10": { "type": "boolean" },
        "overhead_press_10": { "type": "boolean" }
      }
    }
  }
}
