{
  "$schema_version": "1.0",
  "created_at": "2026-08-12T09:00:00Z",
  "updated_at": "2026-08-12T09:00:00Z",
  "user": {
    "name": "Mira"
  },
  "units": "metric",
  "basics": {
    "sex": "female",
    "date_of_birth": "1999-03-21",
    "height": { "value": 165, "unit": "cm" },
    "weight": { "value": 58, "unit": "kg" },
    "bodyfat_bracket": "24-29"
  },
  "experience": {
    "lifting": "beginner",
    "cardio": "intermediate"
  },
  "gym": {
    "type": "commercial_gym",
    "notes": null
  },
  "strength_benchmarks": {
    "pullups_5": false,
    "pullups_10": false,
    "dips_10": false,
    "pushups_15": false,
    "bench_press_10": false,
    "incline_press_10": false,
    "overhead_press_10": false
  }
}
