{
  "$schema_version": "1.0",
  "created_at": "2026-08-12T09:00:00Z",
  "updated_at": "2026-08-12T09:00:00Z",
  "user": {
    "name": "Davood"
  },
  "units": "metric",
  "basics": {
    "sex": "male",
    "date_of_birth": "1993-01-27",
    "height": { "value": 176, "unit": "cm" },
    "weight": { "value": 84, "unit": "kg" },
    "bodyfat_bracket": "13-17"
  },
  "experience": {
    "lifting": "intermediate",
    "cardio": "beginner"
  },
  "gym": {
    "type": "commercial_gym",
    "notes": "Standard chain gym; free-weight area is small and crowded at peak hours."
  },
  "strength_benchmarks": {
    "pullups_5": true,
    "pullups_10": false,
    "dips_10": true,
    "pushups_15": true,
    "bench_press_10": true,
    "incline_press_10": false,
    "overhead_press_10": true
  }
}
